Filename,Title,Transcribed Text
01.mp3,Çiğdem Çiçek, Aylar Oldu Yıllar Oldu Ben Yüzünü Görmedim Yüzüne Hasret Kaldım Kızı Yüzüne Yüzüm Sürümedim Yüzüne Hasret Kaldım Kızı Yüzüne Yüzüm Sürümedim Gülen Aya Sordum Seni Küstü Yüzünü Sakladı Yıldız'a Da Sordum Seni Yüzüme Bile Bakmadı Gülen Aya Sordum Seni Küstü Yüzünü Sakladı Yıldız'a Da Sordum Seni Yıldızlar Kan Ağladı Akşam Olur Ay Gecede Çiğdem Çiçek Şenlenir Akşam Olur Ay Gecede Çiğdem Çiçek Şenlenir Vallah Düşünmesem Seni Derdime Derd Eklenir Bila Düşünmesem Seni Derdime Derd Eklenir Bula Düşünmesem Seni Derdime Derd Eklenir Bıçak Sakladın Sineme Eskidi Yaralarım Sabah Olsun Gelme Eger Kendimi Yaralarım
02.m4a,Bir Karanfil," Çok çok çok iyi ki bir adam. Sen şıkkın ol. Baba öpsün bir kere geçer. Bakayım. Ah. Toparladım kendimi ben. Sevinme hiç boşu boşuna. Hatta bir saray bile yaptım. İçimdeki sen boşluğuna. Sadece bir. Bir kere sordum. İçimden sana. Sadece bir kere sordum. İçimden sana. Bir karanfil toprak üst. Yok mu ismin ezberinde. Yer mi yoktur dizlerinde. Şu başımı koydurmadın. Yer mi yoktur dizlerinde. Şu başımı koydurmadın. Şu başımı koydurmadın. Sadece bir. Bir kere sordum. İçimden sana. Sadece bir. Bir kere sordum. İçimden sana. Bir karanfil toprak üst. Yok mu ismin ezberinde. Şurada. Yer mi yoktur dizlerinde. Şu başımı koydurmadın. Yer mi yoktur dizlerinde. Şu başımı koydurmadın. Yer mi yoktur dizlerinde. Şu başımı koydurmadın. Yer mi yoktu gizliyle, şu başımı koydurmadım. Altyazı M.K."
03.m4a,Gibi," Dört Mevsim Olay Bir gün değil mi? Göz kırpınca geçiyor Aynı bu yıllar gibi boynumda gümüş yok Anlatamadım sana gönül bu istiyor ki batakta altın olayım İsteklerin içleri geri teper Umursadıklarına kuzu gibi yanarsın Sözde emin ellere sarılıp gezerdim Alışkanlıklarımıydı anıştıklarımdansa Biraz durulayım dedim, dedim, dedim başa döndüm Döne döne uzaklara daldım Su, su mu duman aldı? Gemimiz mi su? Esir alıyor beni deli Deli paşa gönlüm, göz göre göre karlı dağlar gibi Gelir başımda dönersin Armanım mı yoksa stresli mi? Bu hepsi acele etti Beni sevmek işinde görmeden sev ama tanımadan sevme Belan olurum, kendi belam olduğum gibi Dörde life el kaburlayan sineman Fakat zaten ehaletmedik hiç olumuz zilleriz Siz make up, biz make it Rap işinde Thunderbolt backup Hayatının datasıyız Final call çepik çepik Fetişim bu istemeden Diss yapın Uyuyor diyebilirsiniz Fakat kalısal bu durumu anlayabilmek için Ölümler sonrasında randevu alabilirsiniz Maalesef bitmiyor bu şeytanlarla savaşımız Gece uyku yok sabah fayda olmadığı gibi Sana ne anlatayım, ne beğenirsin atayım Ortaya bir taş alayının önüne koyup Biraz durulayım dedim, dedim, dedim başa döndüm Döne döne uzaklara daldım Su, su mu duman aldı? Gemimiz mi su? Esir alıyor beni deli Deli paşa gönlüm, göz göre göre karlı dağlar gibi Göz göre göre karlı dağlar gibi Gelir başımda döneriz Biraz durulayım dedim, dedim başa döndüm Döne döne uzaklara daldım Su, su mu duman aldı? Gemimiz mi su? Esir alıyor beni deli Deli paşa gönlüm, göz göre göre karlı dağlar gibi Gelir başımda döneriz O bulutlar gibi, gibi, gibi, gibi Çok uzaklarda hissediyorum Seni, seni hayallerim gibi Biraz kurulayım dedim Dedim taşa döndüm yana O bulutlar gibi, gibi, gibi Esir alıyor beni dila擋a döndüm, dilemma Bu KH- 때도 başımda Gidin elime ğı Obsol- bru, Kayla White Aah, ah, 팬 hadi père alexa yana o da Mär 기 PTSD ar chatter of the year 2 Platform altyazı ve çizgi film almak için faults don't cancel video alexa yanaメタ MO4CHE Bатив Heritage island cumpl Performance Center O distazi Altyazı M.K. Altyazı M.K."
04.m4a,HAVHAVHAV, D D D D Hani neredesin aşkım aşkım Wow Nerenden nerelen Nerenden kim attı o Nerenden kim attı o Şimdi Şimdi Hah nasıl bahsetmem kızlardan Onların görüntüler mandalina Kimlerdensin kimlerden Bebeğim alırım sana sap marina Sezen Aksu'yu okuyan Serdar Ortaç gibisin Aşkım sen ben değilsin Tatlısın aynı Leyla gibisin Ama ben Mecnun değilim Bunlar kolpacı yalan dolan hep baba Burada o babam babam rap Herkes güzeldir sahnesinde bebeğim Biraz da beni manzara daha çek Üzülüyor düşmanlar yaprak dökümü Aşklar diyen de yolluyor götünü Of baya keyifsiz biç göster Herkese gerçek yüzümü Onlar arkadan avlarlarlarlarlarlarlarlarlarlar Dedim ki her şey bende var var var var var var Heh Gece saat üç yollardayım Bazen Azerbağdarlardayım Güzelsin İstanbul kokusundan Kilo hesabı paraları tartmaktayım Dersizsem Fener ben de GSE Yeni markasınız Like Hades'e Millet diyor sihirlisin bence Ben olmasam bilemezdin benze Haydi haydi haydi haydi Kızlar elleri kaldırsın Haydi haydi haydi haydi Herkes gülüyor Herkes gülüyor Herkes gülüyor Herkes gülüyor Herkes gülüyor Herkes gülüyor Herkes gülüyor Herkes gülüyor Herkes gülüyor Herkes gülüyor Herkes gülüyor Herkes gülüyor Herkes gülüyor Heh State Art Elle Sis Skep Mix Role Draw Uzaylılar bir de beni dinliyor
05.m4a,Yoksun," Altyazı M.K. Kaç kere dünyam senin yüzünden zalim Bulsam yine bir yol var, bir yanım enkaz Sensiz olmaz, yanına da kalmaz Adını anmam bir daha bak Duysan, beni bir duysan Yüreği taştan, yokluğu zindan Gidişine susmam, yerine koymam Kimseye ah Yoksun bu kalbi yaksam Sönmez kor gibi zalim Yeterdi bir kere de baksan Sendin benim tek hayalim Kalbim bir hayli hüsran Sebebi sen yine hain Yıkıldı kaç kere dünyam Senin yüzünden zalim Yalnız bende ahı kaldı Silemedim geri resmi kaldı Kaderde ayrı ayrı yazdı Gücüm yeter mi söyle Sensiz kalan Kalbim yaran Yoksun bu kalbi yaksam Sönmez kor gibi zalim Yeterdi bir kere de baksan Sendin benim tek hayalim Kalbim bir hayli hüsran Sebebi sen yine hain Yıkıldı kaç kere dünyam Senin yüzünden zalim"
